Title,Inclusion
"The solubility, permeability and the dose as key factors in formulation development for oral lipophilic drugs: Maximizing the bioavailability of carbamazepine with a cosolvent-based formulation",0
Self-assembling PEG-p(CL-co-TMC) copolymers for oral delivery of poorly water-soluble drugs: a case study with risperidone,0
Quantitative determination of unbound levofloxacin by simultaneous microdialysis in rat pancreas after intravenous and oral doses,0
Efficient gene delivery to myocardium with ultrasound targeted microbubble destruction and polyethylenimine,0
Sirolimus oral absorption in rats is increased by ketoconazole but is not affected by D-alpha-tocopheryl poly(ethylene glycol 1000) succinate,0
Evidence that microplastics aggravate the toxicity of organophosphorus flame retardants in mice (Mus musculus),1
Effects of cholestyramine on lipoprotein levels and metabolism in Syrian hamsters,0
Extracellular cold inducible RNA-binding protein mediates binge alcohol-induced brain hypoactivity and impaired cognition in mice,0
Cellular mechanism of oral absorption of solidified polymer micelles,0
Evaluation in vitro and in vivo of curcumin-loaded mPEG-PLA/TPGS mixed micelles for oral administration,0
Beneficial properties for insulin absorption using superporous hydrogel containing interpenetrating polymer network as oral delivery vehicles,0
Subchronic peroral toxicity of triethylene glycol in the Fischer 344 rat,0
Superior transfection efficiency of phagocytic astrocytes by large chitosan/DNA nanoparticles,0
Toxicity of gold nanoparticles complicated by the co-existence multiscale plastics,0
Self-assembled micelles enhance the oral delivery of curcumin for the management of alcohol-induced tissue injury,0
Enhanced oral absorption and therapeutic effect of acetylpuerarin based on D-α-tocopheryl polyethylene glycol 1000 succinate nanoemulsions,0
Enhancement of Oral Bioavailability of Curcumin by a Novel Solid Dispersion System,0
Block and graft copolymers and NanoGel copolymer networks for DNA delivery into cell,0
Sex-Specific Effects of Polystyrene Microplastic and Lead(II) Co-Exposure on the Gut Microbiome and Fecal Metabolome in C57BL/6 Mice,0
[Study on preparation conditions for polylactide nanoparticles loaded cyclosporine A and its oral bioavailability in rats],0
Combined ultrasound-targeted microbubble destruction and polyethylenimine-mediated plasmid DNA delivery to the rat retina: enhanced efficiency and accelerated expression,0
Oral delivery of spray dried PLGA/amifostine nanoparticles,0
Glycyrrhizic acid-based self-assembled micelles for improving oral bioavailability of paeoniflorin,0
Polymeric Nanocarriers With Mucus-Diffusive and Mucus-Adhesive Properties to Control Pharmacokinetic Behavior of Orally Dosed Cyclosporine A,0
Down-regulation of pancreatic growth and gallbladder contractility by bile salts,0
In vivo mutagenicity assessment of styrene in MutaMouse liver and lung,0
"Sensitization to rodents (mouse/rat) in an urban atopic population without occupational exposure living in Naples, Italy",0
The effect of fluorination of zinc oxide nanoparticles on evaluation of their biodistribution after oral administration,0
The effect of the oral administration of polymeric nanoparticles on the efficacy and toxicity of tamoxifen,0
A microparticle/hydrogel combination drug-delivery system for sustained release of retinoids,0
Development and characterization of high affinity leptins and leptin antagonists,0
An efficient nano-based theranostic system for multi-modal imaging-guided photothermal sterilization in gastrointestinal tract,0
Kolliphor surfactants affect solubilization and bioavailability of fenofibrate. Studies of in vitro digestion and absorption in rats,0
Preparation and evaluation of lectin-conjugated PLGA nanoparticles for oral delivery of thymopentin,0
Retinoic acid-polyethyleneimine complex nanoparticles for embryonic stem cell-derived neuronal differentiation,0
The p-Phthalates Terephthalic Acid and Dimethyl Terephthalate Used in the Manufacture of PET Induce In Vitro Adipocytes Dysfunction by Altering Adipogenesis and Thermogenesis Mechanisms,0
Deciphering Gut Microbiome Responses upon Microplastic Exposure via Integrating Metagenomics and Activity-Based Metabolomics,0
The Bile Sequestrant Cholestyramine Increases Survival in a Rabbit Model of Brodifacoum Poisoning,0
The effect of polyethylene glycol by gavage on electrolyte and water excretion in the rat,0
Hemotoxic effects of polyethylene microplastics on mice,0
"The efficiency and mechanism of a new absorption enhancer, malic acid, for enhancing the oral bioavailability of docetaxel",0
Enhanced cellular uptake and biodistribution of a synthetic cannabinoid loaded in surface-modified poly(lactic-co-glycolic acid) nanoparticles,0
Oral administration of visceral adipose tissue antigens ameliorates metabolic disorders in mice and elevates visceral adipose tissue-resident CD4(+)CD25(+)Foxp3(+) regulatory T cells,0
Effect of the oral intake of probiotic Pediococcus acidilactici BA28 on Helicobacter pylori causing peptic ulcer in C57BL/6 mice models,0
Oral delivery system for low molecular weight protamine-dextran-poly(lactic-co-glycolic acid) carrying exenatide to overcome the mucus barrier and improve intestinal targeting efficiency,0
Double-coated poly (butylcynanoacrylate) nanoparticulate delivery systems for brain targeting of dalargin via oral administration,0
Bacterial species to be considered in quality assurance of mice and rats,0
Thai generic-brand dry canine foods: mutagenicity and the effects of feeding in vivo and in vitro,0
Oral and parenteral therapy with saperconazole (R 66905) of invasive aspergillosis in normal and immunocompromised animals,0
"Bioavailability and tissular distribution of docetaxel, a P-glycoprotein substrate, are modified by interferon-alpha in rats",0
Inhibitive effect of cremophor RH40 or tween 80-based self-microemulsiflying drug delivery system on cytochrome P450 3A enzymes in murine hepatocytes,0
Neuron-specific delivery of nucleic acids mediated by Tet1-modified poly(ethylenimine),0
Oral delivery of mono-PEGylated sCT (Lys18) in rats: regional difference in stability and hypocalcemic effect,0
Mucoadhesive polymers with immobilized proteinase inhibitors for oral administration of protein drugs,0
"In vitro and in vivo evaluation of 3D printed sodium alginate/polyethylene glycol scaffolds for sublingual delivery of insulin: Preparation, characterization, and pharmacokinetics",0
Self-Nanoemulsifying Drug Delivery System of Tetrandrine for Improved Bioavailability: Physicochemical Characterization and Pharmacokinetic Study,0
Preparation and evaluation of valsartan by a novel semi-solid self-microemulsifying delivery system using Gelucire 44/14,0
[Comparison of immune response after oral and intranasal immunization with recombinant Lactobacillus casei expressing ETEC F41],0
Biodistribution and gastrointestinal drug delivery of new lipidic multilamellar vesicles,0
Anti-tumor necrosis factor agent PEG-sTNFRI improves the growth hormone/insulin-like growth factor-I system in adjuvant-induced arthritic rats,0
"W1, a Novel Oral Antiplatelet Agent With Less Resistance Than Clopidogrel",0
"Acute oral toxicity evaluation of biodegradable and pH-sensitive hydrogel based on polycaprolactone, poly(ethylene glycol) and methylacrylic acid (MAA)",0
"Development and characterization of oral lipid-based amphotericin B formulations with enhanced drug solubility, stability and antifungal activity in rats infected with Aspergillus fumigatus or Candida albicans",0
Tf ligand-receptor-mediated exenatide-Zn(2+) complex oral-delivery system for penetration enhancement of exenatide,0
Toxicity of Microplastics and Nanoplastics in Mammalian Systems,1
Synergistic effect of PS-MPs and Cd on male reproductive toxicity: Ferroptosis via Keap1-Nrf2 pathway,1
PS-MPs or their co-exposure with cadmium impair male reproductive function through the miR-199a-5p/HIF-1α-mediated ferroptosis pathway,1
Toxicological effects of micro/nano-plastics on mouse/rat models: a systematic review and meta-analysis,1
PET Tracing of Biodistribution for Orally Administered (64)Cu-Labeled Polystyrene in Mice,1
Inhalation toxicity of polystyrene micro(nano)plastics using modified OECD TG 412,0
PS-MPs promotes the progression of inflammation and fibrosis in diabetic nephropathy through NLRP3/Caspase-1 and TGF-β1/Smad2/3 signaling pathways,1
Cytotoxicity and pro-inflammatory effect of polystyrene nano-plastic and micro-plastic on RAW264.7 cells,0
Blood uptake and urine excretion of nano- and micro-plastics after a single exposure,1
Cellular absorption of polystyrene nanoplastics with different surface functionalization and the toxicity to RAW264.7 macrophage cells,0
Results of a 30-day safety assessment in young mice orally exposed to polystyrene nanoparticles,0
Polystyrene nanoplastics dysregulate lipid metabolism in murine macrophages in vitro,0
Polystyrene nanoplastics dysregulate lipid metabolism in murine macrophages in vitro,0
Lactobacilli can attenuate inflammation in mouse macrophages exposed to polyethylene particles in vitro,0
In vitro study on the toxicity of nanoplastics with different charges to murine splenic lymphocytes,0
Nanoplastics and Arsenic Co-Exposures Exacerbate Oncogenic Biomarkers under an In Vitro Long-Term Exposure Scenario,0
In vitro study on the toxicity of nanoplastics with different charges to murine splenic lymphocytes,0
Aged fragmented-polypropylene microplastics induced ageing statues-dependent bioenergetic imbalance and reductive stress: In vivo and liver organoids-based in vitro study,1
Examining the Relationship Between Polystyrene Microplastics and Male Fertility: Insights From an In Vivo Study and In Vitro Sertoli Cell Culture,1
In vitro and in vivo evaluation of poly(methylidene malonate 2.1.2) microparticles behavior for oral administration,0
Cytotoxicity and macrophage cytokine release induced by ceramic and polyethylene particles in vitro,0
Polyethylene and methyl methacrylate particle-stimulated inflammatory tissue and macrophages up-regulate bone resorption in a murine neonatal calvaria in vitro organ system,0
Effect of modification of polystyrene nanoparticles with different bile acids on their oral transport,0
Effects of microplastics (MPs) and tributyltin (TBT) alone and in combination on bile acids and gut microbiota crosstalk in mice,1
"Reduced dietary Ca, Cu, Zn, Mn, and Mg bioavailability but increased Fe bioavailability with polyethylene microplastic ingestion in a mouse model: Changes in intestinal permeability and gut metabolites",1
Polystyrene nanoparticles aggravate the adverse effects of di-(2-ethylhexyl) phthalate on different segments of intestine in mice,1
Polystyrene nanoparticles enhance the adverse effects of di-(2-ethylhexyl) phthalate on male reproductive system in mice,1
Regulatory drinking in the pigeon Columba livia,0
Uterotrophic assay of two concentrations of migrates from each of 23 polystyrenes administered orally (by gavage) to immature female Wistar rats,0
Domestic Environment and Gut Microbiota: Lessons from Pet Dogs,0
Polystyrene microplastics induce kidney injury via gut barrier dysfunction and C5a/C5aR pathway activation,1
Investigation of Needle Characteristics Using an Animal Model for Improved Outcomes in Anterior Chamber Paracentesis,0
Blood uptake and urine excretion of nano- and micro-plastics after a single exposure,1
Assessing micro and nanoplastics toxicity using rodent models: Investigating potential mitochondrial implications,1
Involvement of the enteroaggregative Escherichia coli plasmid-encoded toxin in causing human intestinal damage,0
Evaluation of Seprafilm and amniotic membrane as adhesion prophylaxis in mesh repair of abdominal wall hernia in rats,0
Therapeutic effects of continuous intraarterial antibiotic infusion in preventing pancreatic infection in experimental acute necrotizing pancreatitis,0
Hazard assessment of small-size plastic particles: is the conceptual framework of particle toxicology useful?,1
Functional proteomic analyses of Bothrops atrox venom reveals phenotypes associated with habitat variation in the Amazon,0
Intranasal human-recombinant NGF administration improves outcome in children with post-traumatic unresponsive wakefulness syndrome,0
Pancreatic duct obstruction is an aggravating factor in the canine model of chronic alcoholic pancreatitis,0
Intestinal uptake of polymer microspheres in the rabbit studied with confocal microscopy,0
In vivo tracking of toxic diesel particulate matter in mice using radiolabeling and nuclear imaging,0
Ingestion of plastics by terrestrial small mammals,1
Influence of suture technique on laparotomy wound healing: An experimental study in the rat,0
Hypothalamic Deep Brain Stimulation Influences Autonomic and Limbic Circuitry Involved in the Regulation of Aggression and Cardiocerebrovascular Control in the Gottingen Minipig,0
Studying microplastics: Lessons from evaluated literature on animal model organisms and experimental approaches,0
Alpha-fetoprotein-thymidine kinase-luciferase knockin mice: A novel model for dual modality longitudinal imaging of tumorigenesis in liver,0
Microplastic-induced NAFLD: Hepatoprotective effects of nanosized selenium,1
PET Imaging and Neurohistochemistry Reveal that Curcumin Attenuates Brain Hypometabolism and Hippocampal Damage Induced by Status Epilepticus in Rats,0
Metabolic correlates of toluene abuse: decline and recovery of function in adolescent animals,0
Polystyrene microplastic-induced oxidative stress triggers intestinal barrier dysfunction via the NF-κB/NLRP3/IL-1β/MCLK pathway,1
"Thirty-Third Nordic Meeting of Gastroenterology, Twenty-Fourth Meeting of Endoscopy (SADE), Twelfth Nordic Meeting of Gastrointestinal Motility (SAGIM) and Annual Endoscopy-Gastroenterology Nurses'-Assistants' Meeting, Reykjavik, Iceland, June 9-12, 2001",0
Assessing microplastic as a vector for chemical entry into fish larvae using a novel tube-feeding approach,0
Microplastic-induced gut microbiota and serum metabolic disruption in Sprague-Dawley rats,1
"Microplastics in the Environment: Intake through the Food Web, Human Exposure and Toxicological Effects",0
Application of organoid technology in the human health risk assessment of microplastics: A review of progresses and challenges,0
Ferret Thoracic Anatomy by 2-Deoxy-2-(18F)Fluoro-D-Glucose (18F-FDG) Positron Emission Tomography/Computed Tomography (18F-FDG PET/CT) Imaging,0
"Effect of polystyrene nanoplastics on cell apoptosis, glucose metabolism, and antibacterial immunity of Eriocheir sinensis",0
Consequences of nano and microplastic exposure in rodent models: the known and unknown,1
How much are microplastics harmful to the health of amphibians? A study with pristine polyethylene microplastics and Physalaemus cuvieri,0
Neurotoxicity of Some Environmental Pollutants to Zebrafish,0
Thyroid and parathyroid function disorders induced by short-term exposure of microplastics and nanoplastics: Exploration of toxic mechanisms and early warning biomarkers,1
"MicroRNAs in non-small cell lung cancer: Gene regulation, impact on cancer cellular processes, and therapeutic potential",0
PET/CT Imaging of c-Myc Transgenic Mice Identifies the Genotoxic N-Nitroso-Diethylamine as Carcinogen in a Short-Term Cancer Bioassay,0
The influence of organ temperature on hepatic ischemia-reperfusion injury: A systematic analysis,0
Colitis and colonic mucosal barrier dysfunction,0
Prevention of gastrointentional tumors based on adenomatous polyposis coli gene mutation by dendrite cell vaccine,0
Toxicity of polystyrene nanoplastics and zinc oxide to mice,1
Effect of fibrin sealant on the integrity of colonic anastomoses in rats with faecal peritonitis,0
PET/CT imaging of 3D printed devices in the gastrointestinal tract of rodents,0
MONOCROTALINE PNEUMOTOXICITY IN MICE,0
Where attention falls: Increased risk of falls from the converging impact of cortical cholinergic and midbrain dopamine loss on striatal function,0
Effect of polylactic acid film barrier on intra-abdominal adhesion formation,0
Polylactic Acid Microplastics Do Not Exhibit Lower Biological Toxicity in Growing Mice Compared to Polyvinyl Chloride Microplastics,1
Simulated gastrointestinal digestion of polylactic acid (PLA) biodegradable microplastics and their interaction with the gut microbiota,0
Folate-conjugated pluronic/polylactic acid polymersomes for oral delivery of paclitaxel,0
Efficacy of New Polylactic Acid Nonwoven Fabric as a Hemostatic Agent in a Rat Liver Resection Model,0
The Role of Two-Step Blending in the Properties of Starch/Chitin/Polylactic Acid Biodegradable Composites for Biomedical Applications,0
The Application of Statins in the Regeneration of Bone Defects. Systematic Review and Meta-Analysis,0
Stealth-nanoparticle strategy for enhancing the efficacy of steroids in mice with noise-induced hearing loss,0
Abusive Head Trauma Animal Models: Focus on Biomarkers,0
A resin-modified glass ionomer cement barrier for treating degree II furcation defects: A pilot study in dogs,0
3D-Printing of Hierarchically Designed and Osteoconductive Bone Tissue Engineering Scaffolds,0
The effect of larger than cell diameter polylactic acid surface patterns on osteogenic differentiation of rat dental pulp stem cells,0
Polylactic acid micro/nanoplastic-induced hepatotoxicity: Investigating food and air sources via multi-omics,1
Polylactic acid-based electrospun fiber and hyaluronic acid-valsartan hydrogel scaffold for chronic wound healing,0
A review on the impacts of nanomaterials on neuromodulation and neurological dysfunction using a zebrafish animal model,0
Polycaprolactone/Polylactic Acid Membrane Fails to Prevent Laminectomy-induced Sprouting of CGRP- and SP-immunopositive Nerve Fibres in the Dura mater lumbalis of Rats,0
Enhanced Bone Healing in Critical-Sized Rabbit Femoral Defects: Impact of Helical and Alternate Scaffold Architectures,0
The immune theory of psychiatric diseases: a key role for activated microglia and circulating monocytes,0
Preparation of Polylactic Acid/Glycolic Acid Copolymer Nanoparticles and Its Effect in the Treatment of Diabetes,0
Impact of aging on animal models of Parkinson's disease,0
"Current fluid biomarkers, animal models, and imaging tools for diagnosing chronic traumatic encephalopathy",0
Reduced Burst Release and Enhanced Oral Bioavailability in Shikimic Acid-Loaded Polylactic Acid Submicron Particles by Coaxial Electrospray,0
Evaluation of polylactic acid nanoparticles safety using Drosophila model,0
A Composite Lactide-Mineral 3D-Printed Scaffold for Bone Repair and Regeneration,0
Ferrets as a Novel Animal Model for Studying Human Respiratory Syncytial Virus Infections in Immunocompetent and Immunocompromised Hosts,0
Hydroxyapatite nanowires modified polylactic acid membrane plays barrier/osteoinduction dual roles and promotes bone regeneration in a rat mandible defect model,0
PLA plastic particles disrupt bile acid metabolism leading to hepatic inflammatory injury in male mice,1
The Delivery Materials with Chemotherapy Drugs for Treatment of the Positive Margin in Solid Tumors,0
Evaluation of the 96/4 PLDLLA polymer resorbable lumbar interbody cage in a long term animal model,0
Preliminary Study on Pharmacokinetics and Antitumor Pharmacodynamics of Folic Acid Modified Crebanine Polyethyleneglycol-Polylactic Acid Hydroxyacetic Acid Copolymer Nanoparticles,0
Animal Models for Target Diseases in Gene Therapy - using DNA and siRNA Delivery Strategies,0
Permanent middle cerebral artery occlusion in sheep: a novel large animal model of focal cerebral ischemia,0
A Simple and Sensitive Method to Quantify Biodegradable Nanoparticle Biodistribution using Europium Chelates,0
Development and validation of Alzheimer's Disease Animal Model for the Purpose of Regenerative Medicine,0
Increase of hippocampal glutamate after electroconvulsive treatment: A quantitative proton MR spectroscopy study at 9.4 T in an animal model of depression,0
Generation of a tumor-specific systemic response after intratumoral injection of IL-12 and IL-18-loaded polylactic acid microspheres,0
Validity of Targeting the Ubiquitin Proteasome System in the Establishment of New Animal Models of Parkinson's Disease,0
"Preparation, Characterization, and Cell Uptake of PLGA/PLA-PEG-FA Nanoparticles",0
Experimental fortification of intestinal anastomoses with nanofibrous materials in a large animal model,0
An orally delivered small-molecule formulation with antiangiogenic and anticancer activity,0
Polystyrene microplastics induced female reproductive toxicity in mice,1
Polyethylene nanoplastics cause reproductive toxicity associated with activation of both estrogenic hormone receptor NHR-14 and DNA damage checkpoints in <i>C. elegans</i>,1
Microbiota-mediated metabolic perturbations in the gut and brain of mice after microplastic exposure,1
Inhalation exposure to polystyrene nanoplastics induces chronic obstructive pulmonary disease-like lung injury in mice through multi-dimensional assessment,0
Combined exposure to lead and microplastics increased risk of glucose metabolism in mice via the Nrf2/NF-κB pathway,1
Environmental microplastic accumulation exacerbates liver ischemia-reperfusion injury in rat: Protective effects of melatonin,1
"Exposure to polystyrene particles causes anxiety-, depression-like behavior and abnormal social behavior in mice",1
Identification of ceRNA network to explain the mechanism of cognitive dysfunctions induced by PS NPs in mice,1
Co-exposure of polystyrene microplastics and iron aggravates cognitive decline in aging mice via ferroptosis induction,1
"Polyvinyl chloride microplastics induced gut barrier dysfunction, microbiota dysbiosis and metabolism disorder in adult mice",1
Polyethylene microplastics induced gut microbiota dysbiosis leading to liver injury via the TLR2/NF-κB/NLRP3 pathway in mice,1
Co-exposure with cadmium elevates the toxicity of microplastics: Trojan horse effect from the perspective of intestinal barrier,1
The size-dependence and reversibility of polystyrene nanoplastics-induced lipid accumulation in mice: Possible roles of lysosomes,1
Gastrointestinal Incomplete Degradation Exacerbates Neurotoxic Effects of PLA Microplastics via Oligomer Nanoplastics Formation,1
Exposure to polystyrene microplastics during lactational period alters immune status in both male mice and their offspring,1
Maternal exposure to polyethylene micro- and nanoplastics impairs umbilical blood flow but not fetal growth in pregnant mice,1
Polystyrene microplastics induce an immunometabolic active state in macrophages,0
Polystyrene microplastics induce mitochondrial damage in mouse GC-2 cells,0
Microplastic polyethylene induced inner ear dysfunction in murine model,1
Maternal nanoplastic ingestion induces an increase in offspring body weight through altered lipid species and microbiota,1
To what extent are orally ingested nanoplastics toxic to the hippocampus in young adult rats?,1
Excretion characteristics of nylon microplastics and absorption risk of nanoplastics in rats,1
Protective effect of Cordycepin on blood-testis barrier against pre-puberty polystyrene nanoplastics exposure in male rats,1
"Effects of nano- and microplastics on kidney: Physicochemical properties, bioaccumulation, oxidative stress and immunoreaction",1
Repair mechanism of Yishen Tongluo formula on mouse sperm DNA fragmentation caused by polystyrene microplastics,1
Aged polystyrene microplastics exacerbate alopecia associated with tight junction injuries and apoptosis via oxidative stress pathway in skin,1
Long-term polystyrene nanoparticles exposure reduces electroretinal responses and exacerbates retinal degeneration induced by light exposure,1
Polystyrene microplastics exacerbated liver injury from cyclophosphamide in mice: Insight into gut microbiota,1
Polystyrene microplastics trigger adiposity in mice by remodeling gut microbiota and boosting fatty acid synthesis,1
Microplastic exposure linked to accelerated aging and impaired adipogenesis in fat cells,0
Nanoplastics cause transgenerational toxicity through inhibiting germline microRNA mir-38 in C. elegans,0
"Effect of polystyrene nanoplastics on cell apoptosis, glucose metabolism, and antibacterial immunity of Eriocheir sinensis",0
Oral subacute polypropylene microplastics administration effect on potential immunotoxicity in ICR mice,1
Hepatotoxic of polystyrene microplastics in aged mice: Focus on the role of gastrointestinal transformation and AMPK/FoxO pathway,1
Cyanidin-3-O-glucoside impacts fecal discharge of polystyrene microplastics in mice: Potential role of microbiota-derived metabolites,1
Combined effect of polystyrene microplastics and cadmium on rat blood-testis barrier integrity and sperm quality,1
Melatonin counteracts polyethylene microplastics induced adreno-cortical damage in male albino rats,1
Microplastic-contaminated antibiotics as an emerging threat to mammalian liver: enhanced oxidative and inflammatory damages,1
Blood uptake and urine excretion of nano- and micro-plastics after a single exposure,1
Polystyrene microplastics disrupt the blood-testis barrier integrity through ROS-Mediated imbalance of mTORC1 and mTORC2,1
Long-Term Exposure to Polystyrene Microspheres and High-Fat Diet-Induced Obesity in Mice: Evaluating a Role for Microbiota Dysbiosis,1
Potential Effects of Orally Ingesting Polyethylene Terephthalate Microplastics on the Mouse Heart,1
Co-exposure of arsenic and polystyrene-nanoplastics induced kidney injury by disrupting mitochondrial homeostasis and mtROS-mediated ferritinophagy and ferroptosis,0
