Title,Inclusion
Lipidomics and transcriptomics insight into impacts of microplastics exposure on hepatic lipid metabolism in mice,1
"Hematological consequences of polyethylene microplastics toxicity in male rats: Oxidative stress, genetic, and epigenetic links",1
Microplastics and Metabolism: Physiological Responses in Mice Following Ingestion,1
Maternal exposure to polystyrene nanoplastics causes defective retinal development and function in progeny mice by disturbing metabolic profiles,1
Melatonin Alleviates Intestinal Barrier Damaging Effects Induced by Polyethylene Microplastics in Albino Rats,1
Polystyrene nanoplastics accelerate atherosclerosis: Unraveling the impact on smooth muscle cells through KIF15-mediated migration,1
Intestinal permeability and gene expression after polyethylene and polyamide microplastic ingestion in Wistar rats,1
Polystyrene Microplastics Induce Injury to the Vascular Endothelial Through NLRP3-Mediated Pyroptosis,1
"Effects of partial reduction of polystyrene micro-nanoplastics on the immunity, gut microbiota and metabolome of mice",1
Microplastics affect arsenic bioavailability by altering gut microbiota and metabolites in a mouse model,1
Toxicity-based toxicokinetic/toxicodynamic assessment for bioaccumulation of polystyrene microplastics in mice,1
Dietary exposure to polystyrene nanoplastics impairs fasting-induced lipolysis in adipose tissue from high-fat diet fed mice,1
Polystyrene microplastics exacerbate experimental colitis in mice tightly associated with the occurrence of hepatic inflammation,1
Identification of micro- and nanoplastic particles in postnatal sprague-dawley rat offspring after maternal inhalation exposure throughout gestation,0
Co-exposure to polystyrene microplastics and lead aggravated ovarian toxicity in female mice via the PERK/eIF2α signaling pathway,1
Impacts of polypropylene microplastics on lipid profiles of mouse liver uncovered by lipidomics analysis and Raman spectroscopy,1
Disturbed Gut-Liver axis indicating oral exposure to polystyrene microplastic potentially increases the risk of insulin resistance,1
"The impact of microplastics polystyrene on the microscopic structure of mouse intestine, tight junction genes and gut microbiota",1
Nrf2-mediated ferroptosis of spermatogenic cells involved in male reproductive toxicity induced by polystyrene nanoplastics in mice,1
Novel Characterization of Constipation Phenotypes in ICR Mice Orally Administrated with Polystyrene Microplastics,1
Reproductive and metabolic toxic effects of polystyrene microplastics in adult female Wistar rats: a mechanistic study,1
Polyethylene nanoplastics cause reproductive toxicity associated with activation of both estrogenic hormone receptor NHR-14 and DNA damage checkpoints in C. elegans,0
Neurobehavioral assessment of rats exposed to pristine polystyrene nanoplastics upon oral exposure,1
Microplastic-induced inhibition of cell adhesion and toxicity evaluation using human dermal fibroblast-derived spheroids,0
Simulated gastrointestinal digestion of polylactic acid (PLA) biodegradable microplastics and their interaction with the gut microbiota,0
New Sight of Renal Toxicity Caused by UV-Aged Polystyrene Nanoplastics: Induced Ferroptosis via Adsorption of Transferrin,1
Polystyrene nanoplastics induced learning and memory impairments in mice by damaging the glymphatic system,1
Analysis of Biodistribution and in vivo Toxicity of Varying Sized Polystyrene Micro and Nanoplastics in Mice,1
Fragile Guts Make Fragile Brains: Intestinal Epithelial Nrf2 Deficiency Exacerbates Neurotoxicity Induced by Polystyrene Nanoplastics,1
The effect and a mechanistic evaluation of polystyrene nanoplastics on a mouse model of type 2 diabetes,1
Size-dependent transgenerational toxicity induced by nanoplastics in nematode Caenorhabditis elegans,0
Environmentally Relevant Concentrations of Microplastic Exposure Cause Cholestasis and Bile Acid Metabolism Dysregulation through a Gut-Liver Loop in Mice,1
Cellular absorption of polystyrene nanoplastics with different surface functionalization and the toxicity to RAW264.7 macrophage cells,0
Subchronic co-exposure of polystyrene nanoplastics and 3-BHA significantly aggravated the reproductive toxicity of ovaries and uterus in female mice,1
Results of a 30-day safety assessment in young mice orally exposed to polystyrene nanoparticles,1
Polystyrene nanoplastics dysregulate lipid metabolism in murine macrophages in vitro,0
Incineration-Generated Polyethylene Micro-Nanoplastics Increase Triglyceride Lipolysis and Absorption in an In Vitro Small Intestinal Epithelium Model,0
"Tissue distribution of polystyrene nanoplastics in mice and their entry, transport, and cytotoxicity to GES-1 cells",1
"Polystyrene microplastics induce endoplasmic reticulum stress, apoptosis and inflammation by disrupting the gut microbiota in carp intestines",0
Exposure to microplastics leads to a defective ovarian function and change in cytoskeleton protein expression in rat,1
Plastic ingestion by fishing cats suggests trophic transfer in urban wetlands,0
Investigation of nephrotoxicity on mice exposed to polystyrene nanoplastics and the potential amelioration effects of DHA-enriched phosphatidylserine,1
Adverse biological effects of ingested polystyrene microplastics using Drosophila melanogaster as a model in vivo organism,0
Lactating exposure to microplastics at the dose of infants ingested during artificial feeding induced reproductive toxicity in female mice and their offspring,1
"Ingestion of polyethylene microbeads affects the growth and reproduction of medaka, Oryzias latipes",0
Polystyrene nanoplastics aggravates lipopolysaccharide-induced apoptosis in mouse kidney cells by regulating IRE1/XBP1 endoplasmic reticulum stress pathway via oxidative stress,1
Polystyrene microplastics exacerbated the toxicity of okadaic acid to the small intestine in mice,1
Microplastic-induced NAFLD: Hepatoprotective effects of nanosized selenium,1
Determination of no observable effect level of nanoplastics on intestinal flora,1
"Exposure to polystyrene nanoplastics induces an anxiolytic-like effect, changes in antipredator defensive response, and DNA damage in Swiss mice",1
Microplastic co-exposure elevates cadmium accumulation in mouse tissue after rice consumption: Mechanisms and health implications,1
"Polystyrene microplastic particles induced hepatotoxic injury via pyroptosis, oxidative stress, and fibrotic changes in adult male albino rats; the therapeutic role of silymarin",1
Polystyrene may alter the cooperation mechanism of gut microbiota and immune system through co-exposure with DCBQ,0
Gender difference in hepatic AMPK pathway activated lipid metabolism induced by aged polystyrene microplastics exposure,1
Nano polystyrene induced changes in anxiety and learning behaviour are mediated through oxidative stress and gene disturbance in mouse brain regions,1
Nano polystyrene induced changes in anxiety and learning behaviour are mediated through oxidative stress and gene disturbance in mouse brain regions,1
Neurotoxic potential of polystyrene nanoplastics in primary cells originating from mouse brain,1
Perturbation of gut microbiota plays an important role in micro/nanoplastics-induced gut barrier dysfunction,1
Polystyrene nanoplastics aggravate reproductive system damage in obese male mice by perturbation of the testis redox homeostasis,1
Polystyrene microplastics cause cardiac fibrosis by activating Wnt/β-catenin signaling pathway and promoting cardiomyocyte apoptosis in rats,1
Effects of microplastics (MPs) and tributyltin (TBT) alone and in combination on bile acids and gut microbiota crosstalk in mice,1
An assessment of the toxicity of polypropylene microplastics in human derived cells,0
Effects of polystyrene nanoplastic size on zebrafish embryo development,0
Prolonged oral ingestion of microplastics induced inflammation in the liver tissues of C57BL/6J mice through polarization of macrophages and increased infiltration of natural killer cells,1
Tailor-Made Protein Corona Formation on Polystyrene Microparticles and its Effect on Epithelial Cell Uptake,0
Photoaging of polystyrene-based microplastics amplifies inflammatory response in macrophages,0
"Oral exposure to polystyrene nanoplastics altered the hypothalamic-pituitary-testicular axis role in hormonal regulation, inducing reproductive toxicity in albino rats",1
Underestimated health risks: Dietary restriction magnify the intestinal barrier dysfunction and liver injury in mice induced by polystyrene microplastics,1
A comparative study in healthy and diabetic mice followed the exposure of polystyrene microplastics: Differential lipid metabolism and inflammation reaction,1
An end to the controversy over the microscopic detection and effects of pristine microplastics in fish organs,0
Acute exposure to polystyrene nanoplastics induces unfolded protein response and global protein ubiquitination in lungs of mice,1
Fat on plastic: Metabolic consequences of an LDPE diet in the fat body of the greater wax moth larvae (Galleria mellonella),0
Microplastics cause reproductive toxicity in male mice through inducing apoptosis of spermatogenic cells via p53 signaling,1
Activation of FGF signal in germline mediates transgenerational toxicity of polystyrene nanoparticles at predicted environmental concentrations in Caenorhabditis elegans,0
Protocol for acquiring samples to assess the impact of microplastics on immune microenvironments in the mouse intestine,0
The effects of repeated oral gavage on the health of male CD-1 mice,1
Assessing the NLRP3 Inflammasome Activating Potential of a Large Panel of Micro- and Nanoplastics in THP-1 Cells,0
Noxic effects of polystyrene microparticles on murine macrophages and epithelial cells,0
The toxic effects of polystyrene microplastic/nanoplastic particles on retinal pigment epithelial cells and retinal tissue,0
Chronic Nicotine Exposure Alters Metabotropic Glutamate Receptor 5: Longitudinal PET Study and Behavioural Assessment in Rats,0
"Screening for polystyrene nanoparticle toxicity on kidneys of adult male albino rats using histopathological, biochemical, and molecular examination results",1
Efficacy of DHA-enriched phosphatidylserine and its underlying mechanism in alleviating polystyrene nanoplastics-induced hepatotoxicity in mice,1
Mucin2 regulated by Ho1/p38/IL-10 axis plays a protective role in polystyrene nanoplastics-mediated intestinal toxicity,1
How much are microplastics harmful to the health of amphibians? A study with pristine polyethylene microplastics and Physalaemus cuvieri,0
Aged fragmented-polypropylene microplastics induced ageing statues-dependent bioenergetic imbalance and reductive stress: In vivo and liver organoids-based in vitro study,1
"Evidence on Invasion of Blood, Adipose Tissues, Nervous System and Reproductive System of Mice After a Single Oral Exposure: Nanoplastics versus Microplastics",1
Liver Injury Induced by Exposure to Polystyrene Microplastics Alone or in Combination with Cadmium in Mice Is Mediated by Oxidative Stress and Apoptosis,1
Ingestion of polyethylene terephthalate microplastic water contaminants by Xenopus laevis tadpoles negatively affects their resistance to ranavirus infection and antiviral immunity,0
Polystyrene nanoplastics of different particle sizes regulate the polarization of pro-inflammatory macrophages,0
Area postrema lesions increase drinking to angiotensin and extracellular dehydration,0
Arsenic and polystyrene-nano plastics co-exposure induced testicular toxicity: Triggers oxidative stress and promotes apoptosis and inflammation in mice,1
Polystyrene nanoparticles aggravate the adverse effects of di-(2-ethylhexyl) phthalate on different segments of intestine in mice,1
The impact of polystyrene microplastics on cardiomyocytes pyroptosis through NLRP3/Caspase-1 signaling pathway and oxidative stress in Wistar rats,1
Polystyrene nanoparticles enhance the adverse effects of di-(2-ethylhexyl) phthalate on male reproductive system in mice,1
Maternal Polystyrene Microplastic Exposure during Gestation and Lactation Altered Metabolic Homeostasis in the Dams and Their F1 and F2 Offspring,1
Histopathological alterations of the vas deferens in rats exposed to polypropylene mesh,1
Effects of vagotomy on drinking in the rat,0
Combined exposure of nano-titanium dioxide and polystyrene nanoplastics exacerbate oxidative stress-induced liver injury in mice by regulating the Keap-1/Nrf2/ARE pathway,1
Examining the Relationship Between Polystyrene Microplastics and Male Fertility: Insights From an In Vivo Study and In Vitro Sertoli Cell Culture,1
Fucoidan from Cladosiphon okamuranus enhances antioxidant activity and prevents reproductive dysfunction in polystyrene microplastic-induced male rats,1
"Anthropogenic particles in coypu (Myocastor coypus; Mammalia, Rodentia)' faeces: first evidence and considerations about their use as track for detecting microplastic pollution",0
The adverse effects of developmental exposure to polystyrene nanoparticles on cognitive function in weaning rats and the protective role of trihydroxy phenolacetone,1
Identification of reliable reference genes for gene expression studies in mouse models under microplastics stress,1
Single pulmonary nanopolystyrene exposure in late-stage pregnancy dysregulates maternal and fetal cardiovascular function,1
Guinea pig (Cavia porcellus) drinking preferences: do nipple drinkers compensate for behaviourally deficient diets?,0
Targeting to intestinal M cells,0
Generation of Eroded Nanoplastics from Domestic Wastes and Their Impact on Macrophage Cell Viability and Gene Expression,0
Evaluation of subchronic toxicity of pet food contaminated with melamine and cyanuric acid in rats,0
Integrated transcriptomic and metabolomic analysis reveals the underlying mechanisms for male reproductive toxicity of polystyrene nanoplastics in mouse spermatocyte-derived GC-2spd(ts) cells,0
Gastric emptying and intestinal absorption of ingested water and saline by hypovolemic rats,0
